{"schema_version":1,"approval_id":"approval_01K20J6M6E6M2YAHG8W0W8N4AN","plan_id":"plan_01K20J6M6E6M2YAHG8W0W8N4AP","plan_digest":"sha256:aaaaaaaaaaaaaaaaaaaaaaaaaaaaaaaaaaaaaaaaaaaaaaaaaaaaaaaaaaaaaaaa","actor_id":"owner:example-user","actor_type":"owner","issued_at":"2026-08-09T00:00:00Z","expires_at":"2026-08-09T01:00:00Z","approval_class":"estate-mutation","scope_digest":"sha256:bbbbbbbbbbbbbbbbbbbbbbbbbbbbbbbbbbbbbbbbbbbbbbbbbbbbbbbbbbbbbbbb","external_reference":"issue:example-org/github-device-sync/123","signature":{"algorithm":"ed25519","key_id":"owner-primary-2026","value":"AAAAAAAAAAAAAAAAAAAAAAAAAAAAAAAAAAAAAAAAAAAAAAAAAAAAAAAAAAAAAAAAAAAAAAAAAAAAAAAAAAAAAA"}}
